{
  "$schema": "https://json-schema.org/draft/2020-12/schema",
  "type": "object",
  "properties": {
    "image": { "type": "string" },
    "name": { "type": "string" },
    "shortDescription": { "type": "string" },
    "tags": {
      "type": "array",
      "items": { "type": "string" },
      "uniqueItems": true
    },
    "patternsGoogleCalendar": {
      "type": "array",
      "items": { "type": "string" },
      "minItems": 1,
      "uniqueItems": true
    },
    "socialLinks": {
      "type": "array",
      "items": {
        "type": "object",
        "properties": {
          "icon": { "type": "string" },
          "name": { "type": "string" },
          "url": { "type": "string" }
        },
        "required": [
          "url"
        ]
      },
      "uniqueItems": true
    },
    "slackChannels": {
      "type": "array",
      "items": { "type": "string" },
      "uniqueItems": true
    },
    "calendars": {
      "type": "array",
      "items": {
        "type": "object",
        "properties": {
          "prefixTag": { "type": "string" },
          "url": { "type": "string" }
        },
        "required": [
          "url"
        ]
      },
      "uniqueItems": true
    }
  },
  "required": [
    "image",
    "name",
    "shortDescription",
    "tags",
    "socialLinks"
  ]
}
