{
  "image": "LyonCafeViePrivee.png",
  "name": "Lyon Café Vie Privée",
  "shortDescription": "Collectif qui anime des ateliers et d'autres événements pour aider tout un chacun à reprendre le contrôle de sa vie privée sur Internet",
  "tags": [
    "Libre",
    "Opensource",
    "Vie privée",
    "flash-parties",
    "smartphones"
  ],
  "patternsGoogleCalendar": [
    "LCVP"
  ],
  "socialLinks": [
    {
      "name": "Site web",
      "url": "https://lyon-cvp.fr"
    },
    {
      "name": "Mastodon",
      "url": "https://mamot.fr/@lyonchiffrofete"
    },
    {
      "name": "Bluesky",
      "url": "https://bsky.app/profile/lyonchiffrofete.mamot.fr.ap.brid.gy"
    }
  ],
  "calendars": [
    { "url": "https://sync.infomaniak.com/calendars/BM04396/a473af33-7790-4622-9d34-b663e9ce2e3d?export" }
  ]
}
